键值,原文,翻译
"Today is a holiday for all christian believers! The rebuilding of the Cathedral of Christ the Saviuor has begun. Cathedrals and churches are also being rebuilt in numerous cities and villages. Communists, supporters of a secular state and muslims are against government support of christianity.","Today is a holiday for all christian believers! The rebuilding of the Cathedral of Christ the Saviuor has begun. Cathedrals and churches are also being rebuilt in numerous cities and villages. Communists, supporters of a secular state and muslims are against government support of christianity.",
"Today is a great day for the entire Soviet Union! We continue the building of the Palace of soviets: 495 metres in height, 100 floors and a giant statue of Lenin, which shows us a path to the wonderful future! It is a great achievement of our country.","Today is a great day for the entire Soviet Union! We continue the building of the Palace of soviets: 495 metres in height, 100 floors and a giant statue of Lenin, which shows us a path to the wonderful future! It is a great achievement of our country.",
"Opposing Parties, who came to power earlier, finally united into a united Party and used everything in order to completely destroy ramnants of junta, liberalise and democratize all spheres of society, while also improving relations with North Korea. Thanks to our initiative, a conferention took place in Seol, during which both Koreas united into a Confederation and declared demilitarisation, uninvolvement in military and political alliances and solving problems collectively, while also remaining independent. It's our diplomatic victory!","Opposing Parties, who came to power earlier, finally united into a united Party and used everything in order to completely destroy ramnants of junta, liberalise and democratize all spheres of society, while also improving relations with North Korea. Thanks to our initiative, a conferention took place in Seol, during which both Koreas united into a Confederation and declared demilitarisation, uninvolvement in military and political alliances and solving problems collectively, while also remaining independent. It's our diplomatic victory!",
"Suggestion of dirty western spy was declined, and he was imprisoned!","Suggestion of dirty western spy was declined, and he was imprisoned!",
Our country has a large nuclear arsenal and will use it in case of agression against us!,Our country has a large nuclear arsenal and will use it in case of agression against us!,
"Poland government has retired. Despite of multiple strikes, Poland became a new part of soviet brotherhood!","Poland government has retired. Despite of multiple strikes, Poland became a new part of soviet brotherhood!",
"Egyptian government supports terrorists! It was discovered by American special services and our government agrees, that we need to continue antiterrorist campaign! Mubarak's government, under pressure from the world and UN sanctions, retired. Free elections took place.","Egyptian government supports terrorists! It was discovered by American special services and our government agrees, that we need to continue antiterrorist campaign! Mubarak's government, under pressure from the world and UN sanctions, retired. Free elections took place.",
"Dirty Egyptian terrorists decide to use force against the world, but their plans were foiled by us! Our brave forces entered Cairo to support local communists.","Dirty Egyptian terrorists decide to use force against the world, but their plans were foiled by us! Our brave forces entered Cairo to support local communists.",
"'Mr Yeltsin uses a lot of lies in his speeches, trying to strengthen his political power. He is powerhungry, and Soviet people must resist him and send him to the West, where he belongs!' - it was your speech, after which your supporters began protests against him and Yeltsin disappointed everyone even more.","'Mr Yeltsin uses a lot of lies in his speeches, trying to strengthen his political power. He is powerhungry, and Soviet people must resist him and send him to the West, where he belongs!' - it was your speech, after which your supporters began protests against him and Yeltsin disappointed everyone even more.",
"After Yeltsin's speech, supporters of reforms used his words as a slogan and are planning political and economical reforms. Glory to the permanent Rebuilding!","After Yeltsin's speech, supporters of reforms used his words as a slogan and are planning political and economical reforms. Glory to the permanent Rebuilding!",
"While multinational coalitional army was successfully freeing Kuwait, our forces attacked Iraq from the back, with the support of communist and shia rebels and also by betrayals inside BAAS. During our military operation Hussein's regime was overthrown by Communistic Party of Iraq. Kuwait is western and Iraq is ours!","While multinational coalitional army was successfully freeing Kuwait, our forces attacked Iraq from the back, with the support of communist and shia rebels and also by betrayals inside BAAS. During our military operation Hussein's regime was overthrown by Communistic Party of Iraq. Kuwait is western and Iraq is ours!",
'Planned economy is the only true economy that ensures stability and equality of all workers in our country!' - these are the current trends in Soviet propaganda.,'Planned economy is the only true economy that ensures stability and equality of all workers in our country!' - these are the current trends in Soviet propaganda.,
"Official Soviet propaganda said, that for 70 years Soviet people went the wrong way and now our country must correct it as soon as possible!","Official Soviet propaganda said, that for 70 years Soviet people went the wrong way and now our country must correct it as soon as possible!",
"Today the damn counterrevolutioners, who wanted to sell our people for a coin, got what they deserved! There will always be planned economy in our home, and their home is prison!","Today the damn counterrevolutioners, who wanted to sell our people for a coin, got what they deserved! There will always be planned economy in our home, and their home is prison!",
"A question asked by journalist helped GKChP activists to find a correct answer - \""Yes, it's a new 1964!\"". Claimed the correctness of the Perestroika's initiatives - way to a collective goverment, improvement of the soviet state machine and fighting dogmatism, they also said that Gorbachev broke these three principles, that his actions were connected with subjectivism, arbitrariness and voluntarism, many dramatic political and economic mistakes were made. And GKChP has gathered to correct them.","A question asked by journalist helped GKChP activists to find a correct answer - \""Yes, it's a new 1964!\"". Claimed the correctness of the Perestroika's initiatives - way to a collective goverment, improvement of the soviet state machine and fighting dogmatism, they also said that Gorbachev broke these three principles, that his actions were connected with subjectivism, arbitrariness and voluntarism, many dramatic political and economic mistakes were made. And GKChP has gathered to correct them.",
"We reunited ROC! Members of former American ROC gained high positions and the Church gained some freedom. The West supports these actions, relations with the USA are improved.\n","We reunited ROC! Members of former American ROC gained high positions and the Church gained some freedom. The West supports these actions, relations with the USA are improved.\n",
New animal breeds\nand new plant sorts will help to create even more healthy\nand delicious food. Let's advance achievements of Michurin!,New animal breeds\nand new plant sorts will help to create even more healthy\nand delicious food. Let's advance achievements of Michurin!,
"A treaty was signed in 1967, which bans expansion of nuclear arms in space... Nonsense! Our latest achievements show that the USSR is starting to get more nuclear power.","A treaty was signed in 1967, which bans expansion of nuclear arms in space... Nonsense! Our latest achievements show that the USSR is starting to get more nuclear power.",
"Americans were the first to land on the Moon, but we will make the first lunar station!","Americans were the first to land on the Moon, but we will make the first lunar station!",
"For many decades, no major steps have been made to further the conquest of space travel. We must change this! The Red flag shall fly over the Red Planet!","For many decades, no major steps have been made to further the conquest of space travel. We must change this! The Red flag shall fly over the Red Planet!",
The enemy is not sleeping! State defense must be equipped with the best technologies.,The enemy is not sleeping! State defense must be equipped with the best technologies.,
"Latest developmnents in the ECM field allow us to fully automatize economy of the USSR. Communism draws near, comrades!","Latest developmnents in the ECM field allow us to fully automatize economy of the USSR. Communism draws near, comrades!",
"Today is a great day, the day, when the whole world became the united Union of Soviet Socialist Republics.\nHOORAY! HOORAY! HOORAY!.","Today is a great day, the day, when the whole world became the united Union of Soviet Socialist Republics.\nHOORAY! HOORAY! HOORAY!.",
You were able to complete Gorbachev's purpose and build Perestroika! Bourgeois democracy and free market are now dominating throughout whole Soviet Union!,You were able to complete Gorbachev's purpose and build Perestroika! Bourgeois democracy and free market are now dominating throughout whole Soviet Union!,
"After deployment of navy in libyan aquatoria, blaming them in support of international terrorism and attacks on airports in Rome and Vienna, the americans have decided to make an airstrikes at Libyan strategic points! How will the Soviet Union respond\?","After deployment of navy in libyan aquatoria, blaming them in support of international terrorism and attacks on airports in Rome and Vienna, the americans have decided to make an airstrikes at Libyan strategic points! How will the Soviet Union respond\?",
"One of newspapers has posted an interview with Yeltsin, where he criticizes us in slow reforming, dogmatism and unprogressiveness! And this newspaper has big circulation...\n","One of newspapers has posted an interview with Yeltsin, where he criticizes us in slow reforming, dogmatism and unprogressiveness! And this newspaper has big circulation...\n",
The GDR leader is going to meet with the FRG leader first time since 1950. It's not our initiative!,The GDR leader is going to meet with the FRG leader first time since 1950. It's not our initiative!,
We can't get humiliated by Americans!,We can't get humiliated by Americans!,
"Your private advisor suggests to deal with our\ncompetitors, who tried to prevent our rise to power\nand will try to futher disturb our action,\nin order to strengthen their own position,\ndiscredit us and usurp our position.\nWe need to show our power,\nwe can't let them to succeed!","Your private advisor suggests to deal with our\ncompetitors, who tried to prevent our rise to power\nand will try to futher disturb our action,\nin order to strengthen their own position,\ndiscredit us and usurp our position.\nWe need to show our power,\nwe can't let them to succeed!",
We can't let them to get away with it!,We can't let them to get away with it!,
It's time for reforms: give all ways to cooperatives!,It's time for reforms: give all ways to cooperatives!,
"Comrade! Today one of previously popular and influential among people and state apparatus politicians, who was both criticized and praised, died. How will we react to this dreadful event\? And is it even bad... \n","Comrade! Today one of previously popular and influential among people and state apparatus politicians, who was both criticized and praised, died. How will we react to this dreadful event\? And is it even bad... \n",
Use nuclear weapons against enemy!,Use nuclear weapons against enemy!,
Use nuclear weapons against enemy!,Use nuclear weapons against enemy!,
We won't be let to use SS guidebooks!,We won't be let to use SS guidebooks!,
Nobody will let us to negotiate with basmachi!,Nobody will let us to negotiate with basmachi!,
Opposition won't take bribes!,Opposition won't take bribes!,
Opposition won't take bribes!,Opposition won't take bribes!,
Supreme Council is against giving up to rebels!,Supreme Council is against giving up to rebels!,
Ecologists are alarmed and\nagricultural workers are demanding changs too.\nWe are exploiting nature too much!,Ecologists are alarmed and\nagricultural workers are demanding changs too.\nWe are exploiting nature too much!,
Nobody will negotiate with revisionists!,Nobody will negotiate with revisionists!,
We odn't have right to negotiate with oligarchs!,We odn't have right to negotiate with oligarchs!,
We must make a move!,We must make a move!,
Congratulate China with their reforms!,Congratulate China with their reforms!,
We can't just sit and wait!,We can't just sit and wait!,
We can't just sit and wait!,We can't just sit and wait!,
Use nukes against the enemy!,Use nukes against the enemy!,
"Far and mysterious Red planet of our system has been a desert for a long time and has never seen a human... Until now. Comrade, I am proud to report, that our manned mission to Mars is a success! Sovet people on board of our interplanetary ship were the first ones to reach Mars! This path wasn't easy. we had to restore Feoktistov's HIS project, then send ship modules to the orbit, so it could be constructed by astronauts on the MIR space station. And of course we had to prepare the crew. Their deed will be remembered by world history and it could become more famous than Neil Armstrong's steps. Our astronauts took soil samples, filmed the chronicles of our martian victory and went for a walk in the desert. Arrival of our heroes is expected to be next year. Now, after our lunar nd martian victories, the USSR is the country, which won the space race.","Far and mysterious Red planet of our system has been a desert for a long time and has never seen a human... Until now. Comrade, I am proud to report, that our manned mission to Mars is a success! Sovet people on board of our interplanetary ship were the first ones to reach Mars! This path wasn't easy. we had to restore Feoktistov's HIS project, then send ship modules to the orbit, so it could be constructed by astronauts on the MIR space station. And of course we had to prepare the crew. Their deed will be remembered by world history and it could become more famous than Neil Armstrong's steps. Our astronauts took soil samples, filmed the chronicles of our martian victory and went for a walk in the desert. Arrival of our heroes is expected to be next year. Now, after our lunar nd martian victories, the USSR is the country, which won the space race.",
"Dear comrade General Secretary! Today is the great day for the USSR and the entire world. Our space program projects finally gave the results. And these results allowed humanity to make agreat advancement in conquest of space. Few hours ago it was reported, that the Soviet lunar crew successfully landed on the Moon and built the station \""Star-1\""! In order to do it we had to send 7 living modules, required tools and Soviet lunar rover \""Korolev 1.1\"". The team which consists of 5 members, leaded by the first men to enter the open space A.A.Leonov, send you a greeting and congratulations with another victory. Yuri Gagarin and Sergey Korolev would be proud of us! Our specialists say that the cureent team will spend 2 years on the Moon and then will be replaced with another one. Modernisation and expansion of Star-1 will take place, more astronauts will be able to live here. What hould we do with our breakthrough\?","Dear comrade General Secretary! Today is the great day for the USSR and the entire world. Our space program projects finally gave the results. And these results allowed humanity to make agreat advancement in conquest of space. Few hours ago it was reported, that the Soviet lunar crew successfully landed on the Moon and built the station \""Star-1\""! In order to do it we had to send 7 living modules, required tools and Soviet lunar rover \""Korolev 1.1\"". The team which consists of 5 members, leaded by the first men to enter the open space A.A.Leonov, send you a greeting and congratulations with another victory. Yuri Gagarin and Sergey Korolev would be proud of us! Our specialists say that the cureent team will spend 2 years on the Moon and then will be replaced with another one. Modernisation and expansion of Star-1 will take place, more astronauts will be able to live here. What hould we do with our breakthrough\?",
Let them fear us!,Let them fear us!,
"It's a catastrophe!\nAll businesses are stopping their work.\nAnd others are falling apart.\nIf we don't do anything,\nthis part of economy will be destroyed.","It's a catastrophe!\nAll businesses are stopping their work.\nAnd others are falling apart.\nIf we don't do anything,\nthis part of economy will be destroyed.",
Supreme Council won't allow giving up to the rebels!,Supreme Council won't allow giving up to the rebels!,
Comrade! Our army is extremely weak and we are almost defenseless. Whole population and the authorities are alarmed. We have to change that!,Comrade! Our army is extremely weak and we are almost defenseless. Whole population and the authorities are alarmed. We have to change that!,
Soviet man mustn't worry about luxuries!,Soviet man mustn't worry about luxuries!,
"Unemployment in our country reached unseen levels. If it continues, unemployed will try to organise our overthrow. We should urgently deal with it!","Unemployment in our country reached unseen levels. If it continues, unemployed will try to organise our overthrow. We should urgently deal with it!",
No negotiations with Albany!,No negotiations with Albany!,
Begin Cultural revolution against them!,Begin Cultural revolution against them!,
Comrade! You are surrounded! All military forces are under our full control and the Party fully supports our actions. Your time is up. We won't allow your pointless repressions and the destruction of leninism. Power must pass to the new and decisive people to create a new type of man - the Soviet man. Give up!,Comrade! You are surrounded! All military forces are under our full control and the Party fully supports our actions. Your time is up. We won't allow your pointless repressions and the destruction of leninism. Power must pass to the new and decisive people to create a new type of man - the Soviet man. Give up!,
Call soldiers for help!,Call soldiers for help!,
"Now, when all our opponents are eliminated, it's time, to secure our country from counterrevolutionaries and consumerist ideology. We are going to continue Andropov's campaign - support discipline, cleanse the government from enemies, with a transfer of power to the Communistic Party of the State Security. And you are the redundant element in our glorious Soviet future. Retire while you can!","Now, when all our opponents are eliminated, it's time, to secure our country from counterrevolutionaries and consumerist ideology. We are going to continue Andropov's campaign - support discipline, cleanse the government from enemies, with a transfer of power to the Communistic Party of the State Security. And you are the redundant element in our glorious Soviet future. Retire while you can!",
"Comrade ruler! Head of the Supreme Council of the Ukrainian SSR remained loyal to you and refused to organise the referendum of the Ukraine's status. After that, people of Ukraine went to the streets and began to protest. The head asks you to resolve this crisis situation","Comrade ruler! Head of the Supreme Council of the Ukrainian SSR remained loyal to you and refused to organise the referendum of the Ukraine's status. After that, people of Ukraine went to the streets and began to protest. The head asks you to resolve this crisis situation",
We can't ignore it!,We can't ignore it!,
"Urgently! Thousands of Belorussians led by nationalistic organisation BNF decided to celebrate day of memory near the place Kuropaty, where a lot of civilians were killed during stalinism (as claimed by an archeologist Nicola Krivaltsevich, who supports BNF - KGB footnote). They demand to admit this fact.","Urgently! Thousands of Belorussians led by nationalistic organisation BNF decided to celebrate day of memory near the place Kuropaty, where a lot of civilians were killed during stalinism (as claimed by an archeologist Nicola Krivaltsevich, who supports BNF - KGB footnote). They demand to admit this fact.",
Claim: It was done by German warmongers!,Claim: It was done by German warmongers!,
We can't ignore it!,We can't ignore it!,
"During the Party meeting, minister of economy suggested to give a free port status to one of our large ports. It won't only increase quality of life and investitions, but will also increase our income from new companies in our country! But should we open doors to the western companies\? And if we should, thaen what city will get this status\?","During the Party meeting, minister of economy suggested to give a free port status to one of our large ports. It won't only increase quality of life and investitions, but will also increase our income from new companies in our country! But should we open doors to the western companies\? And if we should, thaen what city will get this status\?",
Create a free port in Vladivostok!,Create a free port in Vladivostok!,
Create a free port in Odessa!,Create a free port in Odessa!,
"Since the beginning og Khruschev's warming our country massively uses mental asylums in politics: to pursue oppositioners, dissidents and other unwanted elements and enemies of the state. We need to stop it!","Since the beginning og Khruschev's warming our country massively uses mental asylums in politics: to pursue oppositioners, dissidents and other unwanted elements and enemies of the state. We need to stop it!",
"Comrade General Secretary! Poland demands opening investigation and declassifying documents on the Katyn tradegy - mass murder of Polish citizens during WW2. Today in the USSr and countries of a Warsaw pact it is officially claimed that the Nazi Germany is guilty of this murder, accordint to the Soviet investigation, which took place in 1943-1944. But the West accused us of falsifying the investigation. What should we do\?","Comrade General Secretary! Poland demands opening investigation and declassifying documents on the Katyn tradegy - mass murder of Polish citizens during WW2. Today in the USSr and countries of a Warsaw pact it is officially claimed that the Nazi Germany is guilty of this murder, accordint to the Soviet investigation, which took place in 1943-1944. But the West accused us of falsifying the investigation. What should we do\?",
We can't lie to our people!,We can't lie to our people!,
We can't lie to our people!,We can't lie to our people!,
We can't lie to our people!,We can't lie to our people!,
We can't break the principles of democracy!,We can't break the principles of democracy!,
"Comrade! Arguments take place about a legalisation of 'Solidarity' trade union, which was banned in 1982. This trade union illegally operates in Poland, while criticising Soviet power. It unites all people with antisoviet opinions: nationalists, liberals, anarchists. Everybody! What should we do\?","Comrade! Arguments take place about a legalisation of 'Solidarity' trade union, which was banned in 1982. This trade union illegally operates in Poland, while criticising Soviet power. It unites all people with antisoviet opinions: nationalists, liberals, anarchists. Everybody! What should we do\?",
We can't just eliminate them!,We can't just eliminate them!,
We can't break the principles of business!,We can't break the principles of business!,
We can't break the principles of democracy!,We can't break the principles of democracy!,
We can't break the principles of democracy!,We can't break the principles of democracy!,
Lenin is a mushroom!,Lenin is a mushroom!,
We can't ignore it!,We can't ignore it!,
We can't break the principles of free speech!,We can't break the principles of free speech!,
Didn't serve - you aren't a man!,Didn't serve - you aren't a man!,
We can't destroy our army!,We can't destroy our army!,
We can't destroy our army!,We can't destroy our army!,
We need to militarise the society!,We need to militarise the society!,
