键值,原文,翻译
"Coming to power, Mikhail Gorbachev struck everyone with his activity and unstoppable in the accomplishment of new affairs. Everybody expects change from him. Of course, only for the better!","Coming to power, Mikhail Gorbachev struck everyone with his activity and unstoppable in the accomplishment of new affairs. Everybody expects change from him. Of course, only for the better!",
"We warmly welcomed the newly elected Secretary General, Comrade Mikhail Gorbachev, at the plenum of the Central Committee of the CPSU. The audience burst into a storm of standing ovations. Everybody expects change from him. Of course, only for the better!","We warmly welcomed the newly elected Secretary General, Comrade Mikhail Gorbachev, at the plenum of the Central Committee of the CPSU. The audience burst into a storm of standing ovations. Everybody expects change from him. Of course, only for the better!",
"GKCHP\nThanks to your successful conservative rule in Ukraine, given that you did not collude with Ligachev in 88, you were approved into the Security Council of the USSR formed in 1990 and appointed in December 1990 as the Minister of Internal Affairs to stabilize the situation in the country. You quickly dragged your people there and, in August 1991, when the socialist camp collapsed and the same thing threatened the Soviet Union, you became the informal leader of the State Emergency Committee, so Yeltsin was isolated at his cottage, the Supreme Soviet was stormed, and the unrest in the Baltic states suppressed. Gorbachev is gone and now it's your time to rule the country...\nHooray! Hooray! Hooray!\n","GKCHP\nThanks to your successful conservative rule in Ukraine, given that you did not collude with Ligachev in 88, you were approved into the Security Council of the USSR formed in 1990 and appointed in December 1990 as the Minister of Internal Affairs to stabilize the situation in the country. You quickly dragged your people there and, in August 1991, when the socialist camp collapsed and the same thing threatened the Soviet Union, you became the informal leader of the State Emergency Committee, so Yeltsin was isolated at his cottage, the Supreme Soviet was stormed, and the unrest in the Baltic states suppressed. Gorbachev is gone and now it's your time to rule the country...\nHooray! Hooray! Hooray!\n",
"Displacement of the Gorbachev\nGorbachev did not intend to stop there and reported on plans for radical reforms in the country - the introduction of a full-fledged market and the pluralism of political ideologies, and this against the background of the deterioration of the Soviet economy and the growth of nationalism. You opposed this and entered into an alliance with Ligachev and Gromyko, and as a result, at the 1988 plenum, when Gorbachev proposed an early way to implement innovations, you boldly and decisively attacked him, accusing him of voluntarism, the problems of the Soviet economy, and the restoration of capitalism. You were supported by Ligachev and Gromyko. Opponents were not allowed to say a word. Displacement took place.\nHooray! Hooray! Hooray!\n","Displacement of the Gorbachev\nGorbachev did not intend to stop there and reported on plans for radical reforms in the country - the introduction of a full-fledged market and the pluralism of political ideologies, and this against the background of the deterioration of the Soviet economy and the growth of nationalism. You opposed this and entered into an alliance with Ligachev and Gromyko, and as a result, at the 1988 plenum, when Gorbachev proposed an early way to implement innovations, you boldly and decisively attacked him, accusing him of voluntarism, the problems of the Soviet economy, and the restoration of capitalism. You were supported by Ligachev and Gromyko. Opponents were not allowed to say a word. Displacement took place.\nHooray! Hooray! Hooray!\n",
"The First President\nYour flexibility and commitment to the ideas of successive rulers led to the fact that Gorbachev personally praised you for the profound implementation of Perestroika. You were the first after Yeltsin called on the world not to submit to the self-proclaimed State Emergency Committee, and the Ukrainian people elected you the First President of Ukraine in December 1991. And your signature was one of the three, set forth on the documents of the Belovezhsky collusion. Ruling until 1993, you were able to improve your condition to a multitude of billions of dollars, cottages, cars and yachts abroad, negotiate with the Russian Federation on territorial integrity in exchange for the export of nuclear weapons and turn the second industry and economic power into a Soviet republic in one of the most backward countries in Europe.\nJune 9, 1993 in Donbass began an indefinite strike of miners, held against a backdrop of a severe economic crisis. In view of this, the Verkhovna Rada of Ukraine on June 22 went to meet the strikers and fulfilled their demand - they appointed a new presidential election on September 26, 1993. You took second place, receiving 30% of the vote.\nYou have a lot of money. You can live on!\n","The First President\nYour flexibility and commitment to the ideas of successive rulers led to the fact that Gorbachev personally praised you for the profound implementation of Perestroika. You were the first after Yeltsin called on the world not to submit to the self-proclaimed State Emergency Committee, and the Ukrainian people elected you the First President of Ukraine in December 1991. And your signature was one of the three, set forth on the documents of the Belovezhsky collusion. Ruling until 1993, you were able to improve your condition to a multitude of billions of dollars, cottages, cars and yachts abroad, negotiate with the Russian Federation on territorial integrity in exchange for the export of nuclear weapons and turn the second industry and economic power into a Soviet republic in one of the most backward countries in Europe.\nJune 9, 1993 in Donbass began an indefinite strike of miners, held against a backdrop of a severe economic crisis. In view of this, the Verkhovna Rada of Ukraine on June 22 went to meet the strikers and fulfilled their demand - they appointed a new presidential election on September 26, 1993. You took second place, receiving 30% of the vote.\nYou have a lot of money. You can live on!\n",
"Urgent and classified information! At the South-Ukrainian NPP, one of the power units was destroyed, the violation was of the nature of ignition. And if it were at the Chernobyl nuclear power plant, the radius of impact would have been much wider, the inhabitants of neighboring republics would have suffered, and the high level of radiation would have already been quickly detected. However, this is not the Chernobyl nuclear power plant and everything can be fixed. And classified ... About that were last hints from the Center.\n","Urgent and classified information! At the South-Ukrainian NPP, one of the power units was destroyed, the violation was of the nature of ignition. And if it were at the Chernobyl nuclear power plant, the radius of impact would have been much wider, the inhabitants of neighboring republics would have suffered, and the high level of radiation would have already been quickly detected. However, this is not the Chernobyl nuclear power plant and everything can be fixed. And classified ... About that were last hints from the Center.\n",
"Urgent and classified information! At the Chernobyl nuclear power plant, one of the power units was destroyed, the violation was explosive, the reactor was completely destroyed, and a large amount of radioactive substances was emitted into the environment. The catastrophe itself had a negative impact on the inhabitants of the Belarusian SSR. From the Center there are directives not to breed a panic.\n","Urgent and classified information! At the Chernobyl nuclear power plant, one of the power units was destroyed, the violation was explosive, the reactor was completely destroyed, and a large amount of radioactive substances was emitted into the environment. The catastrophe itself had a negative impact on the inhabitants of the Belarusian SSR. From the Center there are directives not to breed a panic.\n",
"Urgent and classified information! At the Chernobyl nuclear power plant three power units were destroyed, the violation was explosive, the reactors were completely destroyed, and a large amount of radioactive substances was emitted into the environment. The catastrophe itself had a negative impact on the inhabitants of the Belarusian SSR. This catastrophic event could threaten your resignation and the death of hundreds of thousands. But from the Center there are directives not to breed a panic ...\n","Urgent and classified information! At the Chernobyl nuclear power plant three power units were destroyed, the violation was explosive, the reactors were completely destroyed, and a large amount of radioactive substances was emitted into the environment. The catastrophe itself had a negative impact on the inhabitants of the Belarusian SSR. This catastrophic event could threaten your resignation and the death of hundreds of thousands. But from the Center there are directives not to breed a panic ...\n",
"Comrade! The May Day demonstration threatens to be thwarted. A crowd of nationalist radicals, together with liberal students, begin to conduct an unauthorized spontaneous rally and are moving toward our May Day demonstration.","Comrade! The May Day demonstration threatens to be thwarted. A crowd of nationalist radicals, together with liberal students, begin to conduct an unauthorized spontaneous rally and are moving toward our May Day demonstration.",
It's just perfect!,It's just perfect!,
Have a nice game!,Have a nice game!,
"Our Motherland need more production! Everyone must work, so we can defeat our enemy!","Our Motherland need more production! Everyone must work, so we can defeat our enemy!",
"Andropov's great plan! Shame for parasites, make them work!","Andropov's great plan! Shame for parasites, make them work!",
"Let the World know, that there is less hard labour in the Soviet Union! We should live, not work for days.","Let the World know, that there is less hard labour in the Soviet Union! We should live, not work for days.",
"Prices under control of the Party! Sausages for 46 kopeikas, ice cream for 48, isn't it beautiful\?","Prices under control of the Party! Sausages for 46 kopeikas, ice cream for 48, isn't it beautiful\?",
"Finally, prices are free! They are controlled by market, not government. It's great, right\?..","Finally, prices are free! They are controlled by market, not government. It's great, right\?..",
Sovet man should only use goods of his Motherland! We won't let foreign goods in our shops!,Sovet man should only use goods of his Motherland! We won't let foreign goods in our shops!,
Capitalistic goods won't reach our country! We accept goods only from socialistic countries!,Capitalistic goods won't reach our country! We accept goods only from socialistic countries!,
We won't allow destruction of our basic industry by foreign goods! We must control their import!,We won't allow destruction of our basic industry by foreign goods! We must control their import!,
Destroy trade barriers! Trade must be free!,Destroy trade barriers! Trade must be free!,
No dimploation with imperialists! They will pay for years of slavery of our comrades!,No dimploation with imperialists! They will pay for years of slavery of our comrades!,
We will terrify the West! We will act directly and without compromise! Let them fear us!,We will terrify the West! We will act directly and without compromise! Let them fear us!,
"We won't attack, but we won't retreat. Engines are turned on, tanks are ready!","We won't attack, but we won't retreat. Engines are turned on, tanks are ready!",
Let there be peace and friendship! In order to ensure stability in the World we must cooperate with the West.,Let there be peace and friendship! In order to ensure stability in the World we must cooperate with the West.,
It's time for integration of Soviet culture in world culture. Participation is more important than victory!,It's time for integration of Soviet culture in world culture. Participation is more important than victory!,
We will start a worldwide fire! It's time to raise workers against their masters!,We will start a worldwide fire! It's time to raise workers against their masters!,
It's time to take our place under the Sun. We will become a new Empire!,It's time to take our place under the Sun. We will become a new Empire!,
Who needs these conventions! We care only about our soldiers and we shouldn't care about our enemy's wellbeing.,Who needs these conventions! We care only about our soldiers and we shouldn't care about our enemy's wellbeing.,
No to bariers! Any citizen of Soviet Union should have a freedom of choice!,No to bariers! Any citizen of Soviet Union should have a freedom of choice!,
Election of a leader is a people's right!,Election of a leader is a people's right!,
"Even after officially declaring scientific atheism as a religion. some citizens still visit churches. We must fight with it, using the most radical methods!","Even after officially declaring scientific atheism as a religion. some citizens still visit churches. We must fight with it, using the most radical methods!",
Partial development of progressive thinking is not enough for our citizens. We are materialistic thinkers and we can confirm it anytime!,Partial development of progressive thinking is not enough for our citizens. We are materialistic thinkers and we can confirm it anytime!,
Our Leader is the Sun of our nation!,Our Leader is the Sun of our nation!,
"One country, one folk, one Leader!","One country, one folk, one Leader!",
Our leader is worthy to lead the way together with Lenin!,Our leader is worthy to lead the way together with Lenin!,
"We are citizens of a progressive state, so we must condemn these barbaric methods!","We are citizens of a progressive state, so we must condemn these barbaric methods!",
Every citizen of the USSR should know how to hold a gun and banish intervents from our Motherland!,Every citizen of the USSR should know how to hold a gun and banish intervents from our Motherland!,
There is no dicrimination in the USSR. Women must defend our country together with men!,There is no dicrimination in the USSR. Women must defend our country together with men!,
Only volunteers should fight for ideals of World Revolution!,Only volunteers should fight for ideals of World Revolution!,
Factories for workers! We won't tolerate bureaucracy!,Factories for workers! We won't tolerate bureaucracy!,
Power to the councils!,Power to the councils!,
Media must show only the truth. And the truth is that Leader and the Party make our life better!,Media must show only the truth. And the truth is that Leader and the Party make our life better!,
We can't allow counterrevolutionary propaganda in our media!,We can't allow counterrevolutionary propaganda in our media!,
Proletariat chooses what to read and what to write!,Proletariat chooses what to read and what to write!,
"State should control thoughts of creators, so they will only publish the art of good quality!","State should control thoughts of creators, so they will only publish the art of good quality!",
USSR is a country of freed working class and freedom is art without limits and borders!,USSR is a country of freed working class and freedom is art without limits and borders!,
There is no place for counterrevolutionaries in the USSR!,There is no place for counterrevolutionaries in the USSR!,
"Our court is the most humane in the world, because it's controlled by workers' state!","Our court is the most humane in the world, because it's controlled by workers' state!",
There is no place for barbaric punishments in the socialistic country. Life is priceless!,There is no place for barbaric punishments in the socialistic country. Life is priceless!,
We won't allow police brutality!,We won't allow police brutality!,
"Too fast of Yeltsin's political career and advocacy of his candidacy brought too much doubt, in consequence of which a comrade Yeltsin was appointed as an additional party oversight. 1st Secretary of Moscow must be clean in every way!","Too fast of Yeltsin's political career and advocacy of his candidacy brought too much doubt, in consequence of which a comrade Yeltsin was appointed as an additional party oversight. 1st Secretary of Moscow must be clean in every way!",
"The talks were held in a friendly note.The Soviet and American sides found a compromise and started to reduce a large number of missiles and weapons, raising the question of world peace.Peace has never been so close!","The talks were held in a friendly note.The Soviet and American sides found a compromise and started to reduce a large number of missiles and weapons, raising the question of world peace.Peace has never been so close!",
"In response to the draft of Americans our honourable Leader, said:'We are not born yesterday and will show the world that American SDI is nothing against increased in the near future us nuclear potential!'. The Western media called it the new Soviet threat.","In response to the draft of Americans our honourable Leader, said:'We are not born yesterday and will show the world that American SDI is nothing against increased in the near future us nuclear potential!'. The Western media called it the new Soviet threat.",
"'Can't compromise on principles!' published March 13, 1988 in the newspaper 'Sovetskaya Rossiya' letter to a teacher at the Leningrad technological Institute, Nina Andreeva, thanks to a few enterprising deputies came to one of the meetings of the Supreme Council.","'Can't compromise on principles!' published March 13, 1988 in the newspaper 'Sovetskaya Rossiya' letter to a teacher at the Leningrad technological Institute, Nina Andreeva, thanks to a few enterprising deputies came to one of the meetings of the Supreme Council.",
"With our significant aid -ammunition, advisors, volunteersand humanitarian aid, prosovietforces seized power in the country.Ura!.","With our significant aid -ammunition, advisors, volunteersand humanitarian aid, prosovietforces seized power in the country.Ura!.",
It's time to deepen our relationship!,It's time to deepen our relationship!,
"Army broke into the building,where the session was taking place.They fully controlled it, sodecisions that you neededwere made. Ave!","Army broke into the building,where the session was taking place.They fully controlled it, sodecisions that you neededwere made. Ave!",
"Army broke into the building,where the session was taking place.They fully controlled it, sodecisions that you neededwere made. Ave!","Army broke into the building,where the session was taking place.They fully controlled it, sodecisions that you neededwere made. Ave!",
You won by a landslide. Congratulations with another victory!,You won by a landslide. Congratulations with another victory!,
Soldiers arrived in time andquickly destroyed chinese forces. Magnificent victory! .,Soldiers arrived in time andquickly destroyed chinese forces. Magnificent victory! .,
"During the negotiations treaties ofnon-agression, limited number of armedforces near the borders andthe partition of territories were made.China abandoned territorial claims.This is our diplomatic victory!","During the negotiations treaties ofnon-agression, limited number of armedforces near the borders andthe partition of territories were made.China abandoned territorial claims.This is our diplomatic victory!",
"Our declaration of creation of the first lunar station shook the world. Photo of the Soviet flag on Moon damaged the authority of the USA government. During one of the press-conferences in the White house there were so much questions about the Soviet lunar base and the USA reaction, that the secretary had to retreat, leaving journalists without information. New stage of popularity of the space travel began in our Motherland. Conspiracy theorists are also very interested in it. They say, that we made a pact with alien civilizations, with which even Hitler had contacts, in order to create our station where we found old station of the Third Reich. Nonsense! Right\?...","Our declaration of creation of the first lunar station shook the world. Photo of the Soviet flag on Moon damaged the authority of the USA government. During one of the press-conferences in the White house there were so much questions about the Soviet lunar base and the USA reaction, that the secretary had to retreat, leaving journalists without information. New stage of popularity of the space travel began in our Motherland. Conspiracy theorists are also very interested in it. They say, that we made a pact with alien civilizations, with which even Hitler had contacts, in order to create our station where we found old station of the Third Reich. Nonsense! Right\?...",
"Chinese example showed usa stupidity of building socialismin a single country,Brezhnev's doctrine and focus on army.State's policies are being reorganised and opposition is being quickly and mercilessly eliminated.Soviet Union will be saved, despite all odds!","Chinese example showed usa stupidity of building socialismin a single country,Brezhnev's doctrine and focus on army.State's policies are being reorganised and opposition is being quickly and mercilessly eliminated.Soviet Union will be saved, despite all odds!",
"Chinese example showed us the importance of informatiion technologies and mass automatisation. Soviet apparatus gives support to the University of Cybernetics with a hope of fast and good result.Opposition is being quickly and mercilessly eliminated.Soviet Union will be saved, despite all odds!","Chinese example showed us the importance of informatiion technologies and mass automatisation. Soviet apparatus gives support to the University of Cybernetics with a hope of fast and good result.Opposition is being quickly and mercilessly eliminated.Soviet Union will be saved, despite all odds!",
"Chinese example showed usthe importance of saving and supporting the current system,without any departure from marxism-leninism.Opposition is being quickly and mercilessly eliminated.Soviet Union will be saved, despite all odds!","Chinese example showed usthe importance of saving and supporting the current system,without any departure from marxism-leninism.Opposition is being quickly and mercilessly eliminated.Soviet Union will be saved, despite all odds!",
Our forces managed to stop the capitalist coup in Iran! The government returned to its former course.,Our forces managed to stop the capitalist coup in Iran! The government returned to its former course.,
You made a wise decision! Creation of a free port in the Far East will increase investitions to this underdeveloped region. Huge investitions and a lot of people will let Vladiviostok to became a city-millionaire in the nearest future! Chinese and Japanese companies have already opened their branches in this city!,You made a wise decision! Creation of a free port in the Far East will increase investitions to this underdeveloped region. Huge investitions and a lot of people will let Vladiviostok to became a city-millionaire in the nearest future! Chinese and Japanese companies have already opened their branches in this city!,
"You made a wise decision! Creation of a free port in the Ukrainian SSR not only will erase unemployment and economical stagnation, but will also grant us a huge income! Odessa has a perspective to become a huge and rich city! A number of European companies have already opened their branches in this city!","You made a wise decision! Creation of a free port in the Ukrainian SSR not only will erase unemployment and economical stagnation, but will also grant us a huge income! Odessa has a perspective to become a huge and rich city! A number of European companies have already opened their branches in this city!",
"Soon, Tavrodi escaped with the money abroad. Fooled people accuse the government!","Soon, Tavrodi escaped with the money abroad. Fooled people accuse the government!",
"Comrade! For the sake of country's safety, security cameras are now installed in public places! Now all criminals will get what they deserve! However, medics say that people show signs of early paranoia epidimic.","Comrade! For the sake of country's safety, security cameras are now installed in public places! Now all criminals will get what they deserve! However, medics say that people show signs of early paranoia epidimic.",
% for joining the RSFSR. Crimean crisis is solved!,% for joining the RSFSR. Crimean crisis is solved!,
"Today a book 'Archipelago GULAG' was published in the USSR. It has already caused some dissonance. Despite the obvious contradictions in this book, Soviet readers, who are unprepared for the freedom of speech and who don't want to spend time in the archives, begin to believe in it. Of course, documentary book, printed in a state's tipography, can't lie!","Today a book 'Archipelago GULAG' was published in the USSR. It has already caused some dissonance. Despite the obvious contradictions in this book, Soviet readers, who are unprepared for the freedom of speech and who don't want to spend time in the archives, begin to believe in it. Of course, documentary book, printed in a state's tipography, can't lie!",
